{
  "$schema": "http://json-schema.org/draft-07/schema#",
  "$id": "https://github.com/Seppun/roll20-character-sheets/Cohors_Cthulhu/npc-import/schema/npc.schema.json",
  "title": "Cohors Cthulhu NPC",
  "description": "One NPC, ready for import into the Cohors Cthulhu Roll20 sheet via api-scripts/ccimport.js. See ../FORMAT.md for a full walkthrough. A file may contain either a single object matching this schema, or a JSON array of them for a batch of NPCs.",
  "type": "object",
  "additionalProperties": false,
  "required": [
    "name",
    "attributes"
  ],
  "properties": {
    "name": {
      "type": "string",
      "minLength": 1,
      "description": "The NPC's name - becomes the Roll20 character's name."
    },
    "npc_type": {
      "type": "string",
      "enum": [
        "trooper",
        "toughened",
        "nemesis"
      ],
      "default": "toughened",
      "description": "The profile's NPC type from the GM's Guide (the line under its name, e.g. \"TOUGHENED NPC\"). Trooper and Toughened use the sheet's compact combat layout; Nemesis gets the full sheet. Also sets the tier defaults for Max Stress (Troopers halve it) and injuries (1/2/3)."
    },
    "allegiance": {
      "type": "string",
      "enum": [
        "adversary",
        "ally"
      ],
      "default": "adversary",
      "description": "Adversaries buy d20s with Threat and turn extra successes into Threat; allies use the party's Momentum like a PC. Can be switched on the sheet at any time."
    },
    "truths": {
      "type": "array",
      "maxItems": 5,
      "items": {
        "type": "string"
      },
      "description": "The profile's TRUTHS lines, one per entry (Troopers have one, Toughened one or two, Nemesis two)."
    },
    "archetype": {
      "type": "string",
      "description": "Free text, matches the PC sheet's own Archetype field - an NPC's archetype rarely matches the fixed PC dropdown list exactly, so this is plain text here."
    },
    "culture": {
      "type": "string"
    },
    "caste": {
      "type": "string"
    },
    "wealth": {
      "type": "string"
    },
    "specialization": {
      "type": "string"
    },
    "background": {
      "type": "string"
    },
    "characteristic": {
      "type": "string"
    },
    "attributes": {
      "type": "object",
      "description": "Ratings for all seven Attributes (rulebook scale, typically 6-16). Use null for an attribute the profile prints as \"—\" (e.g. an animal's Gravitas); the sheet treats it as 0. Extraordinary bonuses printed in parentheses, like \"Brawn 13(2)\", go in special_rules, not here.",
      "additionalProperties": false,
      "required": [
        "agility",
        "brawn",
        "coordination",
        "gravitas",
        "insight",
        "reason",
        "will"
      ],
      "properties": {
        "agility": {
          "type": [
            "integer",
            "null"
          ]
        },
        "brawn": {
          "type": [
            "integer",
            "null"
          ]
        },
        "coordination": {
          "type": [
            "integer",
            "null"
          ]
        },
        "gravitas": {
          "type": [
            "integer",
            "null"
          ]
        },
        "insight": {
          "type": [
            "integer",
            "null"
          ]
        },
        "reason": {
          "type": [
            "integer",
            "null"
          ]
        },
        "will": {
          "type": [
            "integer",
            "null"
          ]
        }
      }
    },
    "skills": {
      "type": "object",
      "description": "Only list skills this NPC actually has ranks in - most NPCs (especially Minions/Toughened) only need a couple. Keys must be one of this game's twelve skill names.",
      "additionalProperties": false,
      "properties": {
        "academia": {
          "$ref": "#/definitions/skill"
        },
        "athletics": {
          "$ref": "#/definitions/skill"
        },
        "crafting": {
          "$ref": "#/definitions/skill"
        },
        "engineering": {
          "$ref": "#/definitions/skill"
        },
        "fighting": {
          "$ref": "#/definitions/skill"
        },
        "medicine": {
          "$ref": "#/definitions/skill"
        },
        "observation": {
          "$ref": "#/definitions/skill"
        },
        "persuasion": {
          "$ref": "#/definitions/skill"
        },
        "resilience": {
          "$ref": "#/definitions/skill"
        },
        "stealth": {
          "$ref": "#/definitions/skill"
        },
        "survival": {
          "$ref": "#/definitions/skill"
        },
        "tactics": {
          "$ref": "#/definitions/skill"
        }
      }
    },
    "talents": {
      "type": "array",
      "description": "Either a name matching this game's talent list (source/data/talents.json) - the importer fills in Keywords/Requirements/Description automatically, same as picking it from the dropdown on a PC sheet - or a custom {name, description} pair for an NPC-only special ability not in that list.",
      "items": {
        "type": "object",
        "additionalProperties": false,
        "required": [
          "name"
        ],
        "properties": {
          "name": {
            "type": "string",
            "minLength": 1
          },
          "description": {
            "type": "string",
            "description": "Omit to resolve name against the known talent list; include to define a custom ability instead."
          }
        }
      }
    },
    "weapons": {
      "type": "array",
      "items": {
        "type": "object",
        "additionalProperties": false,
        "properties": {
          "name": {
            "type": "string",
            "description": "Any name. A name matching this sheet's Weapons suggestion list (see source/views/panels/_weapons_panel.pug) auto-fills the other fields unless overridden; anything else (Claws, Horrific Presence) is a custom attack."
          },
          "focus": {
            "type": "string"
          },
          "reach_range": {
            "type": "string"
          },
          "damage_effects": {
            "type": "string",
            "description": "e.g. \"3, Vicious\" - damage in Challenge Dice followed by comma-separated Damage Effects. For NPCs, copy the profile's printed damage exactly: it already includes attribute bonus damage, Brutal and Fearsome, so the sheet adds nothing on top."
          },
          "size": {
            "type": "string"
          },
          "qualities": {
            "type": "string"
          },
          "type": {
            "type": "string",
            "enum": [
              "melee",
              "ranged",
              "mental"
            ],
            "description": "Attack type. \"mental\" for the profile's (Mental Attack) entries; omit for weapons to infer melee/ranged from focus."
          }
        }
      },
      "description": "The profile's ATTACKS or WEAPONS AND ARMOR entries, including mental attacks. Armor items go in armor, not here."
    },
    "armor": {
      "type": "array",
      "items": {
        "type": "object",
        "additionalProperties": false,
        "properties": {
          "name": {
            "type": "string",
            "description": "Matching a name in this sheet's Armor dropdown (see source/views/panels/_armor_panel.pug) auto-fills resistance/qualities below unless overridden."
          },
          "resistance": {
            "type": [
              "integer",
              "string"
            ]
          },
          "qualities": {
            "type": "string"
          }
        }
      }
    },
    "fatigue": {
      "type": "integer",
      "minimum": 0,
      "default": 0
    },
    "stress": {
      "type": "integer",
      "minimum": 0,
      "default": 0,
      "description": "Current Stress already marked, if this NPC should start partway hurt. The maximum goes in profile.stress."
    },
    "injuries": {
      "type": "string",
      "description": "Injuries already sustained (free text). The injury limit goes in profile.injuries."
    },
    "traits": {
      "type": "string"
    },
    "notes": {
      "type": "string"
    },
    "profile": {
      "type": "object",
      "additionalProperties": false,
      "description": "The stat block's printed totals (STRESS, INJURIES, ARMOR, COURAGE, Power). They already include every special rule's bonus, so they are written to the sheet as-is and win over the sheet's own formulas. Omit any the profile doesn't print.",
      "properties": {
        "stress": {
          "type": "integer",
          "minimum": 0,
          "description": "Printed maximum stress."
        },
        "injuries": {
          "type": "integer",
          "minimum": 1,
          "description": "Printed injuries before defeat (includes Tough X)."
        },
        "armor": {
          "type": "integer",
          "minimum": 0,
          "description": "Printed Armor resistance, including worn armor and Natural Armor."
        },
        "courage": {
          "type": "integer",
          "minimum": 0,
          "description": "Printed Courage resistance, including Natural Courage."
        },
        "morale": {
          "type": "integer",
          "minimum": 0
        },
        "power": {
          "type": "integer",
          "minimum": 0,
          "description": "Printed Power, for spellcasters."
        }
      }
    },
    "special_rules": {
      "type": "array",
      "description": "The profile's SPECIAL RULES. Common ones (Fearsome, Brutal, Tough, Extraordinary Brawn, Natural Armor...) fill in a summary on the sheet if description is omitted; give the profile's own wording in description for anything specific to this NPC.",
      "items": {
        "type": "object",
        "additionalProperties": false,
        "required": [
          "name"
        ],
        "properties": {
          "name": {
            "type": "string",
            "minLength": 1,
            "description": "As printed, e.g. \"Fearsome 2\", \"Immune to Cold\", \"Extraordinary Brawn 2\"."
          },
          "x": {
            "type": "integer",
            "minimum": 0,
            "description": "The rule's X, if it has one. Optional when the name ends with the number."
          },
          "description": {
            "type": "string"
          }
        }
      }
    },
    "spellcasting": {
      "type": "object",
      "additionalProperties": false,
      "description": "For NPC spellcasters (\"uses Will to cast spells\").",
      "properties": {
        "attribute": {
          "type": "string",
          "enum": [
            "insight",
            "reason",
            "will"
          ]
        },
        "tradition": {
          "type": "string",
          "enum": [
            "runic",
            "oracular",
            "celtic",
            "cthulhu",
            "mormo",
            "nyarlathotep",
            "yog_sothoth"
          ],
          "description": "Spellbook the spells come from. The Mythos tomes are cthulhu (Tome of Cthulhu), mormo (Compendium of Mormo), nyarlathotep (Grimoire of Nyarlathotep) and yog_sothoth (Spellbook of Yog-Sothoth)."
        }
      }
    },
    "spells": {
      "type": "array",
      "items": {
        "type": "string"
      },
      "description": "Spell names from spellcasting.tradition, spelled as in source/data/spells.json. Skill/Difficulty/Cost/Effect fill in when the sheet is first opened."
    },
    "rituals": {
      "type": "array",
      "items": {
        "type": "string"
      },
      "description": "Ritual names the profile lists. Rituals aren't battlefield spells, so they're recorded in the NPC's notes."
    },
    "escalation_options": {
      "type": "array",
      "items": {
        "type": "string"
      },
      "description": "The profile's ESCALATION OPTIONS, one entry each, written out in full (e.g. \"Totemic Staff: (Melee), Reach 2, 5, Drain, Stun\")."
    }
  },
  "definitions": {
    "skill": {
      "type": "object",
      "additionalProperties": false,
      "required": [
        "ranks"
      ],
      "properties": {
        "ranks": {
          "type": "integer",
          "minimum": 0
        },
        "focuses": {
          "type": "array",
          "description": "Focus names this NPC knows for this skill, exactly as spelled in that skill's Focus list (see source/views/panels/_skills_panel.pug) - e.g. [\"Melee Weapons\"] for fighting.",
          "items": {
            "type": "string"
          }
        }
      }
    }
  }
}
